id,titulo,fecha_lanzamiento,mini_resumen,director,generos,imagen
1,Jurassic Park,1993-06-11,Un parque con dinosaurios clonados se descontrola.,1,"1,2",
2,Salvar al Soldado Ryan,1998-07-24,Un grupo de soldados busca a un paracaidista perdido durante la Segunda Guerra.,1,"4,3"
3,Inception,2010-07-16,Un ladrón entra en los sueños de las personas para robar ideas.,2,"1,6"
4,Dunkerque,2017-07-21,Evacuación de soldados en la playa de Dunkerque durante la Segunda Guerra Mundial.,2,"4,3"
5,Pulp Fiction,1994-10-14,Historias entrelazadas del crimen en Los Ángeles.,3,"3,5"
6,Kill Bill Vol. 1,2003-10-10,Una asesina busca venganza contra su antiguo equipo.,3,"6"
